{
  "schema_name": "macos-local-vm-unsigned-release-candidate",
  "schema_version": "1.0.0",
  "contract_id": "iar-macos-local-vm-release-identity-2026-09-01.1",
  "contract_digest": "sha256:ebf78abf0a8b1609cf891b96f092065a3e957d4b819e221d47440bacc4f9cf9c",
  "candidate_id": "impresari-context-macos-arm64-0.2.0-candidate-1",
  "candidate_source_revision": "aca656771f9286b13fbcc046b133ade62b58da2a",
  "candidate_source_archive_sha256": "sha256:f26fcf7ccdc6cb499e3eacc1f479a93083c58d397c8730b72a56d43d8c0adb8b",
  "product_version": "0.2.0",
  "target": "aarch64-apple-darwin",
  "build_environment": {
    "macos_product_version": "26.5.1",
    "macos_build_version": "25F80",
    "xcode_version": "26.6",
    "xcode_build_version": "17F113",
    "apple_sdk_version": "26.5",
    "swift_version": "Apple Swift version 6.3.3 (swiftlang-6.3.3.1.3 clang-2100.1.1.101)\nTarget: arm64-apple-macosx26.0\nswift-driver version: 1.148.6",
    "rustc_verbose_version": "rustc 1.98.0 (88d9e12ae 2026-08-18)\nbinary: rustc\ncommit-hash: 88d9e12ae178fab0fb5cc050a94da85685d449ea\ncommit-date: 2026-08-18\nhost: aarch64-apple-darwin\nrelease: 1.98.0\nLLVM version: 22.1.8",
    "cargo_version": "cargo 1.98.0 (797e8a9bc 2026-08-05)",
    "target_triple": "aarch64-apple-darwin"
  },
  "artifacts": [
    {
      "unit_id": "cli-supervisor-entrypoint",
      "bundle_path": "Contents/MacOS/impresari-context",
      "bytes": "8261920",
      "sha256": "sha256:fa1992cd02678c03888a4a5f5a42849880dba42ef9e2b59153c5e66749499bd9",
      "file_format": "mach-o-64-arm64",
      "architectures": [
        "arm64"
      ],
      "unsigned": true,
      "build_log_sha256": "sha256:a5b08dcbab5a8ce57f1f35b734d690bafd188ec3872642b8c418ab65f632669d"
    },
    {
      "unit_id": "isolated-structural-worker",
      "bundle_path": "Contents/Helpers/impresari-context-structural-worker",
      "bytes": "35820544",
      "sha256": "sha256:ab2efcae9c89c2a3cf8543c5be5cf6a63650e0ef689ec2be95df5b48aad103a7",
      "file_format": "mach-o-64-arm64",
      "architectures": [
        "arm64"
      ],
      "unsigned": true,
      "build_log_sha256": "sha256:af02950eccd240aaa22eeb852797cfc64febe9b5520c09270c4e47434ccb8bf2"
    },
    {
      "unit_id": "local-stdio-mcp-server",
      "bundle_path": "Contents/Helpers/impresari-context-mcp",
      "bytes": "4496400",
      "sha256": "sha256:4324a95f4a6ceeb506f659bda8d8a6cb54cb00cbfa0248e81f6b98bb815e086c",
      "file_format": "mach-o-64-arm64",
      "architectures": [
        "arm64"
      ],
      "unsigned": true,
      "build_log_sha256": "sha256:db5bf86635ca342683e79e4bd58eb6222f5a21061e5e73247c842e36eab5a089"
    },
    {
      "unit_id": "local-vm-controller",
      "bundle_path": "Contents/Helpers/impresari-context-vm-controller",
      "bytes": "274704",
      "sha256": "sha256:48689796ad27aa4413a95d23ebb318d14c64a786cf0c5ab1b12553d5d656b7a5",
      "file_format": "mach-o-64-arm64",
      "architectures": [
        "arm64"
      ],
      "unsigned": true,
      "build_log_sha256": "sha256:e3b0c44298fc1c149afbf4c8996fb92427ae41e4649b934ca495991b7852b855"
    }
  ],
  "guest": {
    "guest_release_id": "iar-macos-local-vm-guest-2026-08-31.1",
    "guest_metadata_set_digest": "sha256:ea29c43f36493f7e61935f33a64822805c8275d804c5384c3e8becea849fc54b",
    "guest_metadata_seal_digest": "sha256:c0294a88c2c7fe1d33bdd8ddfbb55e26e6595f02c12a9645c898f36148aa82e1",
    "payload_inventory_sha256": "sha256:1e0097751227d9cd442c0fc8bfe2ef3c83973d1679a4da19eba92004a9d4de1f"
  },
  "product_evidence": {
    "spdx_2_3_sbom_sha256": "sha256:bb249501b6d693edaff188edc2344d1d1a62a94bd13ace8488f4a03e5273a3bb",
    "license_inventory_sha256": "sha256:6f7183c6b0c46d7121c371df536f810677ed843a9f282d454859c3ab04a4c219",
    "vulnerability_assessment_sha256": "sha256:73a56792d4a09d3cf12329e3d46f289ace496eaab42c391c57689726197daea1",
    "reproducibility_disposition_sha256": "sha256:b74119c2acebfdc919c7852cee904016483f93113471bae3a23fd5f56135b59b"
  },
  "compound_identity": "sha256:8d3da788a95c6cf638537218722e5fe32629710a10a3b25c0ac282280ed5720e",
  "controls": {
    "candidate_materialized": true,
    "release_identity_bound": true,
    "developer_id_signature_verified": false,
    "apple_notarization_verified": false,
    "bundle_installed": false,
    "cask_created": false,
    "github_publication_attestation_verified": false,
    "cask_lifecycle_verified": false,
    "sealed_distribution": false,
    "vm_launch": false,
    "analyzer_execution": false,
    "production_admitted": false,
    "macos_iar_1b_admitted": false,
    "authority_added": false
  }
}
